<?xml version="1.0" encoding="UTF-8"?>
<tool xmlns="urn:de.thiema.easyflow/types"
      xmlns:xsi="http://www.w3.org/2001/XMLSchema-instance"
      xsi:schemaLocation="urn:de.thiema.easyflow/types Easyflow.xsd"
      name="SAM/BAM Hybrid Selection Metrics"
      id="PicardHsMetrics"
      version="1.56.0">
  <description>for targeted resequencing data</description>
  
  <requirements>
      <requirement type="package" version="1.56.0">picard</requirement>
   </requirements>
  
    <param name="input_file" type="data" format="sam,bam"
          label="SAM/BAM dataset to generate statistics for"/>
    <param name="out_prefix" type="text" help="Use to remind you what the job was for."
          label="Title for the output file">
      <key>Use</key>
   </param>
    <param name="bait_bed" type="data" format="bed,interval"
          help="Note specific format requirements below!"
          label="Bait intervals: Sequences for bait in the design">
      <key>Note</key>
   </param>
    <param name="target_bed" type="data" format="bed,interval"
          help="Note specific format requirements below!"
          label="Target intervals: Sequences for targets in the design">
      <key>Note</key>
   </param>
    
  
  
    <param name="html_file" type="data" format="html" label="${out_prefix}.html"
          output="true"/>
  
    <data name="html_file" format="html" label="${out_prefix}.html"/>
  
  
  
</tool>