<?xml version="1.0" encoding="UTF-8"?>
<tool xmlns="urn:de.thiema.easyflow/types"
      xmlns:xsi="http://www.w3.org/2001/XMLSchema-instance"
      xsi:schemaLocation="urn:de.thiema.easyflow/types Easyflow.xsd"
      name="Mark Duplicate reads"
      id="rgPicardMarkDups"
      version="1.56.0">
  
  <requirements>
      <requirement type="package" version="1.56.0">picard</requirement>
   </requirements>
  
    <param name="input_file" type="data" format="bam,sam"
          help="If empty, upload or import a SAM/BAM dataset."
          label="SAM/BAM dataset to mark duplicates in"/>
    <param name="out_prefix" type="text" help="Use this remind you what the job was for"
          label="Title for the output file"/>
    <param name="remDups" type="boolean"
          help="If true do not write duplicates to the output file instead of writing them with appropriate flags set."
          label="Remove duplicates from output file"
          defaultValue="true">
      <key>true</key>
   </param>
    <param name="assumeSorted" type="boolean"
          help="If true assume input data are already sorted (most Galaxy SAM/BAM should be)."
          label="Assume reads are already ordered"
          defaultValue="true">
      <key>true</key>
   </param>
     <param name="readRegex" type="text"
          help="Names are parsed to extract: tile/region, x coordinate and y coordinate, to estimate optical duplication rate"
          label="Regular expression that can be used to parse read names in the incoming SAM file"/>
     <param name="optDupeDist" type="integer"
          help="e.g. 5-10 pixels. Later Illumina software versions multiply pixel values by 10, in which case 50-100."
          label="The maximum offset between two duplicate clusters in order to consider them optical duplicates."/>

  
  
    <param name="out_file" type="data" format="bam" label="MarkDups_${out_prefix}.bam"
          output="true"/>
    <param name="html_file" type="data" format="html" label="MarkDups_${out_prefix}.html"
          output="true"/>
  
    <data name="out_file" format="bam" label="MarkDups_${out_prefix}.bam"/>
    <data name="html_file" format="html" label="MarkDups_${out_prefix}.html"/>
  
  
  
  
</tool>