<?xml version="1.0" encoding="UTF-8"?>
<tool xmlns="urn:de.thiema.easyflow/types"
      xmlns:xsi="http://www.w3.org/2001/XMLSchema-instance"
      xsi:schemaLocation="urn:de.thiema.easyflow/types Easyflow.xsd"
      name="Estimate Library Complexity"
      id="rgEstLibComp"
      version="1.56.0">
  <requirements>
      <requirement type="package" version="1.56.0">picard</requirement>
   </requirements>
  
  
    <param name="input_file" type="data" format="bam,sam"
          help="If empty, upload or import a SAM/BAM dataset."
          label="SAM/BAM dataset">
      <key>If</key>
   </param>
    <param name="out_prefix" type="text" help="Use this remind you what the job was for."
          label="Title for the output file">
      <key>Use</key>
   </param>
    <param name="minIDbases" type="integer"
          help="Total_reads / 4^max_id_bases reads will be compared at a time. Lower numbers = more accurate results and exponentially more time/memory."
          label="Minimum identical bases at starts of reads for grouping">
      <key>Total_reads</key>
   </param>
     <param name="maxDiff" type="float"
          help="The maximum rate of differences between two reads to call them identical"
          label="Maximum difference rate for identical reads">
      <key>The</key>
   </param>
     <param name="minMeanQ" type="integer"
          help="The minimum mean quality of bases in a read pair. Lower average quality reads filtered out from all calculations"
          label="Minimum percentage">
      <key>The</key>
   </param>
     <param name="readRegex" type="text"
          help="Names are parsed to extract: tile/region, x coordinate and y coordinate, to estimate optical duplication rate"
          label="Regular expression that can be used to parse read names in the incoming SAM file">
      <key>Names</key>
   </param>
     <param name="optDupeDist" type="text"
          help="e.g. 5-10 pixels. Later Illumina software versions multiply pixel values by 10, in which case 50-100"
          label="The maximum offset between two duplicte clusters in order to consider them optical duplicates.">
      <key>e.g.</key>
   </param>

  
  
    <param name="html_file" type="data" format="html"
          label="${out_prefix}_lib_complexity.html"
          output="true"/>
  
    <data name="html_file" format="html" label="${out_prefix}_lib_complexity.html"/>
  
  
  
</tool>