<?xml version="1.0" encoding="UTF-8"?>
<tool xmlns="urn:de.thiema.easyflow/types"
      xmlns:xsi="http://www.w3.org/2001/XMLSchema-instance"
      xsi:schemaLocation="urn:de.thiema.easyflow/types Easyflow.xsd"
      id="bedtools_coveragebed_counts"
      name="Count intervals in one file overlapping intervals in another file."
      version="0.1.0">

   <requirements>
      <requirement type="binary">coverageBed</requirement>
   </requirements>




    <param name="inputA" type="data" format="bed,bam"
          label="Count how many intervals in this BED or BAM file (source)"/>
    <param name="inputB" type="data" format="bed"
          label="overlap the intervals in this BED file (target)"/>
    <param name="split" type="boolean"
          help="If set, the coverage will be calculated based the spliced intervals only. For BAM files, this inspects the CIGAR N operation to infer the blocks for computing coverage. For BED12 files, this inspects the BlockCount, BlockStarts, and BlockEnds fields (i.e., columns 10,11,12). If this option is not set, coverage will be calculated based on the interval's START/END coordinates, and would include introns in the case of RNAseq data."
          label="Treat split/spliced BAM or BED12 entries as distinct BED intervals when computing coverage."
          defaultValue="true">
      <key type="short">split</key>
      <key>If</key>
   </param>
    
    <param name="strand" type="select" label="Count"/>



    <param name="output" type="data" format="bed"
          label="count of overlaps in ${inputA.name} on ${inputB.name}"
          output="true"/>

    <data name="output" format="bed"
         label="count of overlaps in ${inputA.name} on ${inputB.name}"
         metadata_source="inputB"/>



</tool>