<?xml version="1.0" encoding="UTF-8"?>
<tool xmlns="urn:de.thiema.easyflow/types"
      xmlns:xsi="http://www.w3.org/2001/XMLSchema-instance"
      xsi:schemaLocation="urn:de.thiema.easyflow/types Easyflow.xsd"
      name="Insertion size metrics"
      id="PicardInsertSize"
      version="1.56.0">
  <description>for PAIRED data</description>
  <requirements>
      <requirement type="package" version="1.56.0">picard</requirement>
   </requirements>
  
  
    <param name="input_file" type="data" format="bam,sam"
          help="If empty, upload or import a SAM/BAM dataset."
          label="SAM/BAM dataset to generate statistics for">
      <key>If</key>
   </param>
    <param name="out_prefix" type="text" help="Use this remind you what the job was for"
          label="Title for the output file">
      <key>Use</key>
   </param>
    <param name="deviations" type="float"
          help="See Picard documentation: Generate mean, sd and plots by trimming the data down to MEDIAN + DEVIATIONS*MEDIAN_ABSOLUTE_DEVIATION"
          label="Deviations">
      <key>See</key>
   </param>
     <param name="histWidth" type="integer"
          help="Explicitly sets the histogram width option - leave 0 to ignore"
          label="Histogram width">
      <key>Explicitly</key>
   </param>
     <param name="minPct" type="float"
          help="Discard any data categories (out of FR, TANDEM, RF) that have fewer than this percentage of overall reads"
          label="Minimum percentage">
      <key>Discard</key>
   </param>
     <param name="malevel" type="select"
          help="Level(s) at which metrics will be accumulated"
          label="Metric Accumulation Level">
      <key>Level(s)</key>
   </param>
  
  
    <param name="html_file" type="data" format="html"
          label="InsertSize_${out_prefix}.html"
          output="true"/>
  
    <data name="html_file" format="html" label="InsertSize_${out_prefix}.html"/>
  
  
  
</tool>