<?xml version="1.0" encoding="UTF-8"?>
<tool xmlns="urn:de.thiema.easyflow/types"
      xmlns:xsi="http://www.w3.org/2001/XMLSchema-instance"
      xsi:schemaLocation="urn:de.thiema.easyflow/types Easyflow.xsd"
      name="Reorder SAM/BAM"
      id="picard_ReorderSam"
      version="1.56.0">
  <requirements>
      <requirement type="package" version="1.56.0">picard</requirement>
   </requirements>
  
  
    <param name="inputFile" type="data" format="bam,sam"
          help="If empty, upload or import a SAM/BAM dataset."
          label="SAM/BAM dataset to be reordered">
      <key>If</key>
   </param>
    <param name="refFile" type="data" format="fasta" label="Using reference file"/>
   <param name="speciesName" type="text" label="Species name"/>
   <param name="buildName" type="text" label="Build name"/>
   <param name="truncateSeqNames" type="boolean"
          label="Truncate sequence names after first whitespace"
          defaultValue="true">
      <key>true</key>
   </param>
    <param name="allowIncDictConcord" type="boolean"
          help="Allows a partial overlap of the BAM contigs with the new reference sequence contigs."
          label="Allow incomplete dict concordance?"
          defaultValue="true">
      <key>true</key>
      <key>Allows</key>
   </param>
    <param name="allowContigLenDiscord" type="boolean"
          help="This is dangerous--don't check it unless you know exactly what you're doing!"
          label="Allow contig length discordance?"
          defaultValue="true">
      <key>true</key>
      <key>This</key>
   </param>
    <param name="outputFormat" type="boolean" help="Uncheck for SAM output"
          label="Output BAM instead of SAM"
          defaultValue="true">
      <key>bam</key>
      <key>Uncheck</key>
   </param>
  
  
    <param name="outFile" type="data" format="bam"
          label="${tool.name} on ${on_string}: reordered ${outputFormat}"
          output="true"/>
  
    <data name="outFile" format="bam"
         label="${tool.name} on ${on_string}: reordered ${outputFormat}">
      <change_format>
        <when input="outputFormat" value="sam" format="sam"/>
      </change_format>
    </data>
  
  
  
</tool>